{
  "actor": {
    "name": "tenant",
    "description": "Council tenant — reports problem with photo, verifies operative, confirms satisfaction"
  },
  "connection": {
    "gatewayUrl": "http://localhost",
    "registerId": "{{registerId}}",
    "credentials": {
      "email": "{{roles.tenant.email}}",
      "password": "$env:TENANT_PASSWORD",
      "organizationId": "{{roles.tenant.organizationId}}"
    },
    "walletAddress": "{{roles.tenant.walletAddress}}"
  },
  "inbox": {
    "signalR": { "enabled": true },
    "polling": { "enabled": true, "intervalSeconds": 15 }
  },
  "mode": "rules",
  "rules": [
    {
      "actionName": "Report Problem",
      "decision": "approve",
      "preActions": [
        {
          "type": "file-upload",
          "config": {
            "fieldName": "damagePhoto",
            "sizeBytes": 4096,
            "seed": 42,
            "fileName": "damage-photo.jpg",
            "contentType": "image/jpeg"
          }
        }
      ],
      "payload": {
        "tenantName": "Flora MacInnes",
        "contactPhone": "+44 1463 555 201",
        "propertyAddress": {
          "street": "14 Moray Crescent",
          "town": "Carronbridge",
          "postcode": "SC4 2TL"
        },
        "description": "Kitchen tap is leaking continuously. Water has caused damage to the chipboard cabinet underneath the sink. The cabinet door is swollen and won't close properly.",
        "category": "Plumbing",
        "urgencyDescription": "Not an emergency but getting worse — bucket filling up twice a day",
        "accessNotes": "Key safe at side gate, code shared with housing office. Available weekdays 9am-5pm."
      }
    },
    {
      "actionName": "Verify Operative",
      "decision": "approve",
      "payload": {
        "operativeVerified": true,
        "verificationNotes": "Credential matches — Jamie Crawford, Stoniebridge Construction"
      }
    },
    {
      "actionName": "Confirm Satisfaction",
      "decision": "approve",
      "payload": {
        "satisfied": true,
        "feedbackNotes": "Very tidy job, thank you. Kitchen is back to normal.",
        "rating": 5
      }
    }
  ],
  "resilience": {
    "retryCount": 3,
    "retryDelaySeconds": 2,
    "circuitBreakerThreshold": 5,
    "circuitBreakerDurationSeconds": 30
  },
  "logging": {
    "level": "Information",
    "actionLog": "./logs/tenant-actions.jsonl"
  }
}
