{
  "actor": {
    "name": "contractor",
    "description": "Submits building application with plans and site data"
  },
  "connection": {
    "gatewayUrl": "http://localhost",
    "registerId": "{{registerId}}",
    "credentials": {
      "email": "{{roles.contractor.email}}",
      "password": "$env:CONTRACTOR_PASSWORD",
      "organizationId": "{{roles.contractor.organizationId}}"
    },
    "walletAddress": "{{roles.contractor.walletAddress}}"
  },
  "inbox": {
    "signalR": { "enabled": true },
    "polling": { "enabled": true, "intervalSeconds": 30 }
  },
  "mode": "rules",
  "rules": [
    {
      "actionName": "Submit Application",
      "decision": "approve",
      "payload": {
        "projectName": "Carronbridge Heights",
        "siteAddress": "14 Waterfront Lane, Carronbridge, SC1 4WL",
        "buildingType": "residential",
        "estimatedValue": 500000,
        "grossFloorArea": 800,
        "storeys": 3,
        "existingStructure": false
      }
    }
  ],
  "resilience": {
    "retryCount": 3,
    "retryDelaySeconds": 2,
    "circuitBreakerThreshold": 5,
    "circuitBreakerDurationSeconds": 30
  },
  "logging": {
    "level": "Information",
    "actionLog": "./logs/contractor-actions.jsonl"
  }
}
