{
  "actor": {
    "name": "sales-mgr-ai",
    "description": "AI-powered sales manager using Claude to generate contextual responses (Highland Timber Supplies)"
  },
  "connection": {
    "gatewayUrl": "http://localhost",
    "registerId": "{{registers.sme-trade-register.id}}",
    "credentials": {
      "email": "{{roles.sales-mgr.email}}",
      "password": "$env:SALES_MGR_PASSWORD",
      "organizationId": "{{roles.sales-mgr.organizationId}}"
    },
    "walletAddress": "{{roles.sales-mgr.walletAddress}}"
  },
  "inbox": {
    "signalR": { "enabled": true },
    "polling": { "enabled": true, "intervalSeconds": 20 }
  },
  "mode": "ai",
  "ai": {
    "promptFile": "./prompts/sales-mgr-ai.md",
    "model": "claude-sonnet-4-6",
    "temperature": 0.4
  },
  "resilience": {
    "retryCount": 3,
    "retryDelaySeconds": 2,
    "circuitBreakerThreshold": 5,
    "circuitBreakerDurationSeconds": 30
  },
  "logging": {
    "level": "Information",
    "actionLog": "./logs/sales-mgr-ai-actions.jsonl"
  }
}
