{
  "actor": {
    "name": "building-control",
    "description": "Technical inspection, compliance check, and fee calculation"
  },
  "connection": {
    "gatewayUrl": "http://localhost",
    "registerId": "{{registerId}}",
    "credentials": {
      "email": "{{roles.building-control.email}}",
      "password": "$env:INSPECTOR_PASSWORD",
      "organizationId": "{{roles.building-control.organizationId}}"
    },
    "walletAddress": "{{roles.building-control.walletAddress}}"
  },
  "inbox": {
    "signalR": { "enabled": true },
    "polling": { "enabled": true, "intervalSeconds": 30 }
  },
  "mode": "rules",
  "rules": [
    {
      "actionName": "Building Control Inspection",
      "decision": "approve",
      "payload": {
        "structuralApproved": true,
        "fireCompliant": true,
        "accessCompliant": true,
        "inspectionNotes": "All structural, fire safety, and accessibility requirements met. Building regulations compliance confirmed."
      }
    }
  ],
  "logging": {
    "level": "Information",
    "actionLog": "./logs/building-control-actions.jsonl"
  }
}
