{
  "actor": {
    "name": "housing-officer",
    "description": "Housing Officer — triages requests, allocates contractor, reviews completion"
  },
  "connection": {
    "gatewayUrl": "http://localhost",
    "registerId": "{{registerId}}",
    "credentials": {
      "email": "{{roles.housing-officer.email}}",
      "password": "$env:HOUSING_OFFICER_PASSWORD",
      "organizationId": "{{roles.housing-officer.organizationId}}"
    },
    "walletAddress": "{{roles.housing-officer.walletAddress}}"
  },
  "inbox": {
    "signalR": { "enabled": true },
    "polling": { "enabled": true, "intervalSeconds": 15 }
  },
  "mode": "rules",
  "rules": [
    {
      "actionName": "Triage & Allocate",
      "decision": "approve",
      "payload": {
        "severity": "Routine",
        "targetCompletionDate": "2026-04-25",
        "requirements": [
          "Replace tap unit (mixer tap, kitchen spec)",
          "Check isolation valve under sink",
          "Inspect for further water damage to adjacent units",
          "Replace damaged cabinet panel if beyond repair"
        ],
        "allocationNotes": "Standard plumbing job. Tenant has key safe access so no need for appointment.",
        "assignedOperativeName": "Jamie Crawford"
      }
    },
    {
      "actionName": "Review Completion",
      "decision": "approve",
      "payload": {
        "decision": "Accepted",
        "reviewNotes": "All checklist items completed. Photos show clean installation. No further action required."
      }
    }
  ],
  "resilience": {
    "retryCount": 3,
    "retryDelaySeconds": 2,
    "circuitBreakerThreshold": 5,
    "circuitBreakerDurationSeconds": 30
  },
  "logging": {
    "level": "Information",
    "actionLog": "./logs/housing-officer-actions.jsonl"
  }
}
