{
  "actor": {
    "name": "finance-director",
    "description": "Requests invoice financing with VC presentation (Highland Timber)"
  },
  "connection": {
    "gatewayUrl": "http://localhost",
    "registerId": "{{registers.trade-finance-register.id}}",
    "credentials": {
      "email": "{{roles.finance-director.email}}",
      "password": "$env:FINANCE_DIRECTOR_PASSWORD",
      "organizationId": "{{roles.finance-director.organizationId}}"
    },
    "walletAddress": "{{roles.finance-director.walletAddress}}"
  },
  "inbox": {
    "signalR": { "enabled": true },
    "polling": { "enabled": true, "intervalSeconds": 20 }
  },
  "mode": "rules",
  "rules": [
    {
      "actionName": "Request Financing",
      "decision": "approve",
      "payload": {
        "invoiceReference": "HTS-INV-2026-03847",
        "invoiceAmount": 10248,
        "buyerName": "Cairngorm Construction Ltd",
        "requestedAdvancePercentage": 90,
        "urgency": "standard"
      }
    }
  ],
  "logging": {
    "level": "Information",
    "actionLog": "./logs/finance-director-actions.jsonl"
  }
}
