{
  "actor": {
    "name": "citizen",
    "description": "Reference-only actor for the AssuredIdentity citizen role. The citizen is script-driven (run-phase1-identity.ps1 / run-phase2-licence.ps1) because they submit the starting actions, present credentials via sorcha-agent haip present, and claim credentials via sorcha-agent haip receive — all of which need explicit orchestration the run scripts provide. This config exists so `sorcha-agent validate` sees every participant declared in the walkthrough, and so future work could promote the citizen to a rules/AI-mode actor if we ever want a fully autonomous demo."
  },
  "connection": {
    "gatewayUrl": "http://localhost",
    "registerId": "{{registerId}}",
    "credentials": {
      "email": "{{roles.citizen.email}}",
      "password": "$env:CITIZEN_PASSWORD",
      "organizationId": "{{roles.citizen.organizationId}}"
    },
    "walletAddress": "{{roles.citizen.walletAddress}}"
  },
  "inbox": {
    "signalR": { "enabled": true },
    "polling": { "enabled": true, "intervalSeconds": 30 }
  },
  "mode": "rules",
  "rules": [],
  "logging": {
    "level": "Information",
    "actionLog": "./logs/citizen-actions.jsonl"
  }
}
