{
  "actor": {
    "name": "credit-analyst",
    "description": "Evaluates and approves/declines financing (ScotTrade Finance)"
  },
  "connection": {
    "gatewayUrl": "http://localhost",
    "registerId": "{{registers.trade-finance-register.id}}",
    "credentials": {
      "email": "{{roles.credit-analyst.email}}",
      "password": "$env:CREDIT_ANALYST_PASSWORD",
      "organizationId": "{{roles.credit-analyst.organizationId}}"
    },
    "walletAddress": "{{roles.credit-analyst.walletAddress}}"
  },
  "inbox": {
    "signalR": { "enabled": true },
    "polling": { "enabled": true, "intervalSeconds": 20 }
  },
  "mode": "rules",
  "rules": [
    {
      "actionName": "Evaluate Application",
      "decision": "approve",
      "payload": {
        "evaluationNotes": "Verified invoice credential confirmed. Buyer credit score 85/100 — well above 60-point threshold. Invoice amount £10,248 within £250,000 credit limit. Low risk rating. Standard advance terms recommended.",
        "advancePercentage": 90,
        "feeRate": 2.5
      }
    },
    {
      "actionName": "Approve/Decline Financing",
      "decision": "approve",
      "payload": {
        "decision": "approve",
        "advanceAmount": 9223.20,
        "feeAmount": 230.58,
        "netAdvance": 8992.62,
        "repaymentTerms": "Net 30 from original invoice due date",
        "repaymentDate": "2026-05-17",
        "financingReference": "STF-FIN-2026-00291"
      }
    }
  ],
  "logging": {
    "level": "Information",
    "actionLog": "./logs/credit-analyst-actions.jsonl"
  }
}
