{
  "actor": {
    "name": "finance-director-ai",
    "description": "AI-powered finance director using Claude to generate contextual responses (Highland Timber Supplies)"
  },
  "connection": {
    "gatewayUrl": "http://localhost",
    "registerId": "{{registers.trade-finance-register.id}}",
    "credentials": {
      "email": "{{roles.finance-director.email}}",
      "password": "$env:FINANCE_DIRECTOR_PASSWORD",
      "organizationId": "{{roles.finance-director.organizationId}}"
    },
    "walletAddress": "{{roles.finance-director.walletAddress}}"
  },
  "inbox": {
    "signalR": { "enabled": true },
    "polling": { "enabled": true, "intervalSeconds": 20 }
  },
  "mode": "ai",
  "ai": {
    "promptFile": "./prompts/finance-director-ai.md",
    "model": "claude-sonnet-4-6",
    "temperature": 0.3
  },
  "resilience": {
    "retryCount": 3,
    "retryDelaySeconds": 2,
    "circuitBreakerThreshold": 5,
    "circuitBreakerDurationSeconds": 30
  },
  "logging": {
    "level": "Information",
    "actionLog": "./logs/finance-director-ai-actions.jsonl"
  }
}
