{
  "actor": {
    "name": "verification-analyst",
    "description": "Deterministic identity-validator agent — auto-approves Assured Identity applications (demo rules mode)."
  },
  "connection": {
    "gatewayUrl": "{{gateway}}",
    "registerId": "{{registerId}}",
    "credentials": {
      "email": "$env:AGENT_EMAIL",
      "password": "$env:AGENT_PASSWORD",
      "organizationId": "{{orgId}}"
    },
    "walletAddress": "{{analystWallet}}"
  },
  "inbox": {
    "signalR": { "enabled": true },
    "polling": { "enabled": true, "intervalSeconds": 15 }
  },
  "mode": "rules",
  "rules": [
    {
      "actionName": "Verify Assured Identity Application",
      "condition": { "==": [true, true] },
      "decision": "approve",
      "payload": {
        "decision": "approved",
        "verificationNotes": "Auto-approved by the demo identity-validator agent (rules mode)."
      }
    }
  ]
}
