{
  "actor": {
    "name": "assessment-svc-ai",
    "description": "AI-powered credit assessment service using Claude to generate contextual responses (UK Trade Credit Bureau)"
  },
  "connection": {
    "gatewayUrl": "http://localhost",
    "registerId": "{{registers.trade-finance-register.id}}",
    "credentials": {
      "email": "{{roles.assessment-svc.email}}",
      "password": "$env:ASSESSMENT_SVC_PASSWORD",
      "organizationId": "{{roles.assessment-svc.organizationId}}"
    },
    "walletAddress": "{{roles.assessment-svc.walletAddress}}"
  },
  "inbox": {
    "signalR": { "enabled": true },
    "polling": { "enabled": true, "intervalSeconds": 20 }
  },
  "mode": "ai",
  "ai": {
    "promptFile": "./prompts/assessment-svc-ai.md",
    "model": "claude-sonnet-4-6",
    "temperature": 0.2
  },
  "resilience": {
    "retryCount": 3,
    "retryDelaySeconds": 2,
    "circuitBreakerThreshold": 5,
    "circuitBreakerDurationSeconds": 30
  },
  "logging": {
    "level": "Information",
    "actionLog": "./logs/assessment-svc-ai-actions.jsonl"
  }
}
